{
  "schemaVersion": 1,
  "id": "skill-creator",
  "review": {
    "role": "independent",
    "reviewedAt": "2026-07-22T21:28:27.000Z",
    "gitRevision": "531491fb16e738aa9f30c8ac9156ab713b8411fe",
    "reviewedInputDigest": "6dcafc4f123e7f5bf111805e08547d4ab34be2e0b5b5be1ae245f067b860080d",
    "contexts": {
      "scout": {
        "id": "task-9-scout",
        "completedAt": "2026-07-22T18:00:00.000Z"
      },
      "implementer": {
        "id": "task-9-implementation-remediation",
        "completedAt": "2026-07-22T20:37:12.000Z"
      },
      "verifier": {
        "id": "task-9-independent-review-main-lineage-531491f",
        "startedAt": "2026-07-22T21:25:00.000Z"
      }
    }
  },
  "userOutcome": "author a conformant Ziggy Skill",
  "target": {
    "mechanism": "core-skill",
    "id": "skill-writing"
  },
  "overlap": [],
  "capabilityContract": {
    "scenarioIds": ["s4.skill-writing"]
  },
  "budgets": {
    "production": {
      "allowedFiles": [
        "packages/core/src/provider-runtime.ts",
        "packages/core/src/skills/skill-writing/SKILL.md",
        "packages/core/src/skills/skill-writing/index.ts",
        "packages/core/src/skills/skill-writing/text.d.ts"
      ],
      "maximumLines": 353,
      "lineMetric": "physical-non-generated-text-lines-final-partial-counted"
    },
    "runtimeDependencies": ["Ziggy Skill/manifest schemas"],
    "permissions": {
      "network": false,
      "filesystem": "profile",
      "secrets": [],
      "externalAuthorities": ["owner-approved Extension/Skill files"]
    },
    "subprocesses": [],
    "persistedStatePaths": [],
    "supportMaterial": {
      "files": [],
      "maximumFiles": 0,
      "maximumBytes": 0
    }
  },
  "removableMaterial": [],
  "assertions": {
    "lowestTrustTier": true,
    "noDuplicateAuthority": true,
    "noCompatibilityShim": true,
    "noInactiveVendoredMaterial": true
  },
  "findings": [],
  "disposition": "accepted"
}
